{
  "title": "M&A Theory Learning Map",
  "description": "A concise theory path for VFCC preparation across historical analysis, valuation, and board-level recommendation.",
  "weeks": [
    {
      "id": "week-2",
      "number": 2,
      "label": "Week 2",
      "title": "Historical Analysis and Forecast Architecture",
      "summary": "Build a traceable three-year historical model and a driver-based five-year forecast that can support valuation, due diligence, and a board-level recommendation.",
      "topics": [
        {
          "id": "w2-source-controlled-history",
          "title": "Source-Controlled History",
          "summary": "Create a consistent historical dataset in fixed units and periods, with every reported fact traceable to a filing, note, or case exhibit.",
          "learningQuestions": [
            "Can five sampled historical figures be traced to their exact source?",
            "Do the model totals reconcile to the published statements?"
          ],
          "subtopics": [
            "Three-year income statement, balance sheet, and cash flow history",
            "Units, fiscal periods, and actual-versus-forecast labels",
            "Source and assumption register",
            "Reported-total reconciliations"
          ],
          "sourceIds": ["src-week2-module", "src-opentuition-statements"]
        },
        {
          "id": "w2-operating-economics",
          "title": "Operating Economics",
          "summary": "Translate reported statements into operating drivers and explain how price, volume, mix, capacity, costs, and cash conversion shape performance.",
          "learningQuestions": [
            "Which operating drivers explain the historical revenue and margin bridges?",
            "What evidence separates a durable trend from a temporary movement?"
          ],
          "subtopics": [
            "Revenue bridge: price, volume, mix, acquisitions, foreign exchange, and disposals",
            "Margin bridge: pricing, input costs, utilisation, labour, and overhead absorption",
            "Investment bridge: maintenance and growth capital expenditure",
            "Debt and cash bridge"
          ],
          "sourceIds": ["src-week2-module", "src-opentuition-statements"]
        },
        {
          "id": "w2-working-capital",
          "title": "Working Capital",
          "summary": "Model operating working capital as a cash cycle, keeping cash and financing items separate from day-to-day operating balances.",
          "learningQuestions": [
            "Why can improving receivable days still coexist with weak revenue quality?",
            "Which operating flow is the correct denominator for each days calculation?"
          ],
          "subtopics": [
            "Receivable, inventory, and payable days",
            "Operating net working capital",
            "Cash operating cycle",
            "Seasonality, ageing, factoring, and supplier finance"
          ],
          "sourceIds": ["src-week2-module", "src-opentuition-working-capital"]
        },
        {
          "id": "w2-normalisation-quality",
          "title": "Normalisation and Quality",
          "summary": "Keep reported and adjusted performance separate, and test whether earnings, assets, liabilities, and cash conversion represent sustainable economics.",
          "learningQuestions": [
            "Is each adjustment supported by recurrence, operating relevance, cash effect, and forecast treatment?",
            "How should weak information quality change assumptions, valuation range, or the price ceiling?"
          ],
          "subtopics": [
            "Quality-of-earnings bridge",
            "Recurring versus non-recurring items",
            "Capitalisation and classification choices",
            "Accruals, provisions, estimates, and disclosure consistency"
          ],
          "sourceIds": ["src-week2-module", "src-wangerin-2019", "src-mcnichols-stubben-2015"]
        },
        {
          "id": "w2-driver-forecast",
          "title": "Driver-Based Forecast",
          "summary": "Build the forecast in causal order so that operational assumptions flow through revenue, costs, working capital, investment, tax, and financing.",
          "learningQuestions": [
            "What operational evidence supports each forecast driver?",
            "Do changes to a key assumption flow through the complete model?"
          ],
          "subtopics": [
            "Price-volume and business-specific revenue drivers",
            "Variable, semi-variable, and fixed operating costs",
            "Capital expenditure, depreciation, and asset roll-forwards",
            "Accounting tax, cash tax, financing, and balance items"
          ],
          "sourceIds": ["src-week2-module", "src-opentuition-cash-flows"]
        },
        {
          "id": "w2-scenarios-controls",
          "title": "Scenarios and Controls",
          "summary": "Use coherent base, upside, and downside narratives, with traceable assumptions, controlled circularity, and a prominent error-check panel.",
          "learningQuestions": [
            "Does each scenario tell a plausible operating story rather than apply a uniform haircut?",
            "Can an independent reviewer detect stale links, hard-coded outputs, and unintended circularity?"
          ],
          "subtopics": [
            "Base, upside, and downside operating narratives",
            "Scenario switches",
            "Balance, flow, and roll-forward checks",
            "Independent formula and source review"
          ],
          "sourceIds": ["src-week2-module"]
        },
        {
          "id": "w2-ev-equity-bridge",
          "title": "EV-to-Equity Bridge",
          "summary": "Translate enterprise value to equity value using a documented and internally consistent classification of cash, debt, leases, investments, and other claims.",
          "learningQuestions": [
            "Is each bridge item treated consistently with the forecast and valuation method?",
            "Which bridge classification is most judgmental and what evidence would resolve it?"
          ],
          "subtopics": [
            "Excess and restricted cash",
            "Borrowings and lease liabilities",
            "Pensions, minority interests, and non-operating investments",
            "Supplier finance, provisions, and tax liabilities"
          ],
          "sourceIds": ["src-week2-module", "src-opentuition-afm"]
        }
      ]
    },
    {
      "id": "week-3",
      "number": 3,
      "label": "Week 3",
      "title": "Valuation and Transaction Pricing",
      "summary": "Convert operating forecasts into a defensible valuation range, reconcile multiple methods, and define a price boundary that reflects risk and deal logic.",
      "topics": [
        {
          "id": "w3-valuation-frame",
          "title": "Valuation Frame",
          "summary": "Define the asset being valued, the valuation date, the ownership claim, and the information available before choosing a method.",
          "learningQuestions": [
            "Are enterprise and equity value kept distinct throughout the analysis?",
            "Which valuation methods fit the business and the decision?"
          ],
          "subtopics": [
            "Valuation date and information set",
            "Going-concern and control assumptions",
            "Enterprise value versus equity value",
            "Method selection and triangulation"
          ],
          "sourceIds": ["src-damodaran-valuation", "src-mckinsey-valuation"]
        },
        {
          "id": "w3-discounted-cash-flow",
          "title": "Discounted Cash Flow",
          "summary": "Value the operating business from forecast free cash flow, using internally consistent cash flows, discount rates, and timing conventions.",
          "learningQuestions": [
            "Do the cash-flow definition and discount rate measure the same claim?",
            "Which forecast assumptions drive most of the present value?"
          ],
          "subtopics": [
            "Unlevered and levered cash flow",
            "Mid-year and year-end timing",
            "Present value mechanics",
            "Reconciliation to the operating forecast"
          ],
          "sourceIds": ["src-damodaran-valuation", "src-opentuition-afm"]
        },
        {
          "id": "w3-discount-rate",
          "title": "Discount Rate",
          "summary": "Estimate a discount rate that matches the currency, risk, leverage, and cash-flow claim without hiding operating uncertainty inside one premium.",
          "learningQuestions": [
            "Are risk-free rate, beta, risk premium, and cost of debt measured consistently?",
            "How does target capital structure affect WACC?"
          ],
          "subtopics": [
            "Cost of equity and CAPM",
            "Cost of debt and tax shield",
            "Unlevering and relevering beta",
            "Currency, country risk, and capital structure"
          ],
          "sourceIds": ["src-damodaran-data", "src-damodaran-valuation"]
        },
        {
          "id": "w3-terminal-value",
          "title": "Terminal Value",
          "summary": "Model a mature steady state that respects reinvestment, growth, returns on capital, and the economic life of the business.",
          "learningQuestions": [
            "Is perpetual growth supportable in the chosen currency and market?",
            "Does terminal reinvestment support the assumed growth?"
          ],
          "subtopics": [
            "Perpetuity-growth method",
            "Exit-multiple cross-check",
            "Steady-state margins and reinvestment",
            "Terminal-value concentration risk"
          ],
          "sourceIds": ["src-damodaran-valuation", "src-mckinsey-valuation"]
        },
        {
          "id": "w3-trading-comparables",
          "title": "Trading Comparables",